{
  "app_pulse": {
    "frequency_hz": 0.03723273816076889,
    "fresh": true,
    "measured_at_utc": "2026-06-25T20:22:43.850629+00:00",
    "period_s": 26.858083756345174,
    "source": "current_measurement"
  },
  "breathing_rhythm": {
    "exhale_s": 13.0,
    "inhale_s": 13.0,
    "locked": true,
    "mode": "fixed_13_13",
    "period_s": 26.0
  },
  "current_measurement": {
    "background_bands_hz": [
      [
        0.028,
        0.0345
      ],
      [
        0.0425,
        0.049
      ]
    ],
    "best_station": {
      "code": "IU.ANMO",
      "detected": true,
      "error": null,
      "frequency_hz": 0.03648148148148148,
      "label": "Albuquerque, New Mexico",
      "period_s": 27.411167512690355,
      "snr": 3.607885499998858
    },
    "confidence_label": "high (multiple stations, tight agreement)",
    "detected": true,
    "frequency_hz": 0.03723273816076889,
    "measured_at_utc": "2026-06-25T20:22:43.850629+00:00",
    "median_snr": 2.4757533248114303,
    "period_s": 26.858083756345174,
    "quality_status": "confirmed",
    "snr_threshold": 3.0,
    "station_errors": 0,
    "stations": [
      {
        "code": "II.SHEL",
        "detected": true,
        "error": null,
        "frequency_hz": 0.038015586390420075,
        "label": "St. Helena, South Atlantic",
        "period_s": 26.304999999999996,
        "snr": 3.4005998360688423
      },
      {
        "code": "II.ASCN",
        "detected": false,
        "error": null,
        "frequency_hz": 0.0377643504531722,
        "label": "Ascension Island, South Atlantic",
        "period_s": 26.48,
        "snr": 1.8419545846317955
      },
      {
        "code": "II.BFO",
        "detected": false,
        "error": null,
        "frequency_hz": 0.037554255519909416,
        "label": "Black Forest, Germany",
        "period_s": 26.628140703517587,
        "snr": 2.815868649763596
      },
      {
        "code": "II.MBAR",
        "detected": false,
        "error": null,
        "frequency_hz": 0.040262172284644196,
        "label": "Mbarara, Uganda",
        "period_s": 24.83720930232558,
        "snr": 2.1356379998592643
      },
      {
        "code": "IU.TSUM",
        "detected": false,
        "error": null,
        "frequency_hz": 0.039629629629629626,
        "label": "Tsumeb, Namibia",
        "period_s": 25.233644859813086,
        "snr": 1.6271259062588204
      },
      {
        "code": "IU.ANMO",
        "detected": true,
        "error": null,
        "frequency_hz": 0.03648148148148148,
        "label": "Albuquerque, New Mexico",
        "period_s": 27.411167512690355,
        "snr": 3.607885499998858
      }
    ],
    "stations_attempted": 6,
    "stations_detected": 2,
    "target_band_hz": [
      0.036,
      0.041
    ],
    "target_frequency_hz": 0.038461538461538464,
    "target_period_s": 26.0,
    "window_hours": 6.0
  },
  "expires_at_utc": "2026-06-26T08:22:43.850652+00:00",
  "generated_at_utc": "2026-06-25T20:22:43.850652+00:00",
  "history": [
    {
      "best_snr": 5.4645224771470735,
      "best_station_code": "IU.TSUM",
      "detected": true,
      "frequency_hz": 0.03685185185185185,
      "measured_at_utc": "2026-06-24T18:07:29.112703+00:00",
      "median_snr": 1.8366353228815304,
      "period_s": 27.1356783919598,
      "quality_status": "weak_single_station",
      "stations_attempted": 6,
      "stations_detected": 1
    },
    {
      "best_snr": 5.564324711428244,
      "best_station_code": "IU.TSUM",
      "detected": true,
      "frequency_hz": 0.03685185185185185,
      "measured_at_utc": "2026-06-24T18:08:51.325557+00:00",
      "median_snr": 1.748679128464024,
      "period_s": 27.1356783919598,
      "quality_status": "weak_single_station",
      "stations_attempted": 6,
      "stations_detected": 1
    },
    {
      "best_snr": 5.821452553202124,
      "best_station_code": "II.SHEL",
      "detected": true,
      "frequency_hz": 0.03780608845299469,
      "measured_at_utc": "2026-06-24T18:10:36.041499+00:00",
      "median_snr": 1.646005085589143,
      "period_s": 26.450766025248193,
      "quality_status": "confirmed",
      "stations_attempted": 6,
      "stations_detected": 2
    },
    {
      "best_snr": 5.370801954918663,
      "best_station_code": "II.SHEL",
      "detected": true,
      "frequency_hz": 0.0375834684348605,
      "measured_at_utc": "2026-06-24T18:59:21.666724+00:00",
      "median_snr": 1.6840628117214198,
      "period_s": 26.60744315637594,
      "quality_status": "confirmed",
      "stations_attempted": 6,
      "stations_detected": 2
    },
    {
      "best_snr": 2.399269057079256,
      "best_station_code": "IU.ANMO",
      "detected": false,
      "frequency_hz": null,
      "measured_at_utc": "2026-06-25T08:20:02.898596+00:00",
      "median_snr": 2.118026624261976,
      "period_s": null,
      "quality_status": "not_detected",
      "stations_attempted": 6,
      "stations_detected": 0
    },
    {
      "best_snr": 2.4897602021638354,
      "best_station_code": "IU.ANMO",
      "detected": false,
      "frequency_hz": null,
      "measured_at_utc": "2026-06-25T08:23:16.524084+00:00",
      "median_snr": 1.9007535660264434,
      "period_s": null,
      "quality_status": "not_detected",
      "stations_attempted": 6,
      "stations_detected": 0
    },
    {
      "best_snr": 2.5355911163200306,
      "best_station_code": "IU.ANMO",
      "detected": false,
      "frequency_hz": null,
      "measured_at_utc": "2026-06-25T08:25:25.793273+00:00",
      "median_snr": 2.100194164244347,
      "period_s": null,
      "quality_status": "not_detected",
      "stations_attempted": 6,
      "stations_detected": 0
    },
    {
      "best_snr": 3.7944777476939078,
      "best_station_code": "IU.ANMO",
      "detected": true,
      "frequency_hz": 0.038424151957103234,
      "measured_at_utc": "2026-06-25T15:12:57.297360+00:00",
      "median_snr": 2.879515031646309,
      "period_s": 26.0252978677682,
      "quality_status": "confirmed",
      "stations_attempted": 6,
      "stations_detected": 2
    },
    {
      "best_snr": 3.607885499998858,
      "best_station_code": "IU.ANMO",
      "detected": true,
      "frequency_hz": 0.03723273816076889,
      "measured_at_utc": "2026-06-25T20:22:43.850629+00:00",
      "median_snr": 2.4757533248114303,
      "period_s": 26.858083756345174,
      "quality_status": "confirmed",
      "stations_attempted": 6,
      "stations_detected": 2
    }
  ],
  "last_good_measurement": {
    "best_station": {
      "code": "IU.ANMO",
      "detected": true,
      "error": null,
      "frequency_hz": 0.03648148148148148,
      "label": "Albuquerque, New Mexico",
      "period_s": 27.411167512690355,
      "snr": 3.607885499998858
    },
    "confidence_label": "high (multiple stations, tight agreement)",
    "frequency_hz": 0.03723273816076889,
    "measured_at_utc": "2026-06-25T20:22:43.850629+00:00",
    "median_snr": 2.4757533248114303,
    "period_s": 26.858083756345174,
    "stations_attempted": 6,
    "stations_detected": 2
  },
  "schema_version": "1.0.0"
}
